{
  "canvas": {
    "height": 720,
    "ppt_dpi": 96,
    "width": 1280
  },
  "meta": {
    "audience": "管理层与渠道负责人，现场复盘会 + 会后异步阅读",
    "base_dir": "/home/user/ppt-visual-art-director/examples",
    "brief_sha256": "7c9a2224966ea799dac6db05700af94cc30a4aaaada22d447c844bdedb6b05b1",
    "decision": "批准 Q1 把预算从直营门店转投到经销渠道",
    "metric_units": {
      "单店月均产出降幅": [
        "%"
      ],
      "电商": [
        "%"
      ],
      "直营门店": [
        "%"
      ],
      "直营门店单店月均产出": [
        "万元"
      ],
      "经销": [
        "%"
      ],
      "经销渠道单店月均产出": [
        "万元"
      ],
      "门店数量": [
        "家"
      ],
      "门店数量增幅": [
        "%"
      ]
    },
    "plan_schema": "pvad-plan-v1",
    "policy_sha256": "d3029cad5c48a83dd02c8d56181cdccfd5514366ca828b7c1fc8deb76a3e9fa5",
    "title": "澄海净水 2026 渠道复盘",
    "visual_world": "中性纸面：单一底色 + 墨色文字 + 一个语义强调色；材质与光影不参与叙事"
  },
  "schema": "pvad-deck-v1",
  "slides": [
    {
      "accent_elements": 0,
      "composition": "image_narrative",
      "composition_downgraded": "",
      "composition_why": "作者声明了 hero 素材：视觉主体占主区，文字退到安全区，先验证可读性再谈构图",
      "elements": [
        {
          "_measured": {
            "degraded": false,
            "lines": 1,
            "max_line_width": 17.7
          },
          "align": "left",
          "anchor": "top",
          "bold": false,
          "color": "muted",
          "height": 21,
          "id": "s01.eyebrow",
          "layout_source": "plan",
          "line_height": 1.42,
          "max_lines": 2,
          "role": "eyebrow",
          "size": 15.0,
          "text": "01",
          "tracking": 0.8,
          "type": "text",
          "width": 544.0,
          "wrap": true,
          "x": 72.0,
          "y": 56.0
        },
        {
          "_measured": {
            "degraded": false,
            "lines": 1,
            "max_line_width": 471.6
          },
          "align": "left",
          "anchor": "top",
          "bold": true,
          "color": "ink",
          "height": 72,
          "id": "s01.claim",
          "layout_source": "plan",
          "line_height": 1.12,
          "max_lines": 3,
          "role": "claim",
          "size": 60.0,
          "text": "加店不再带来增长",
          "tracking": -0.9,
          "type": "text",
          "width": 568.0,
          "wrap": true,
          "x": 72.0,
          "y": 120.0
        },
        {
          "asset_sha256": "60c959d7833fcb1b5e0499bf2cbec8b40e574a68052880a881b9e72b8b906969",
          "crop": [
            0.23504273504273504,
            0.0,
            0.23504273504273504,
            0.0
          ],
          "crop_loss": 1.887,
          "fit": "cover",
          "format": "JPEG",
          "function": "hero",
          "height": 624.0,
          "id": "s01.media",
          "layout_source": "author",
          "reason": "让观众看见渠道现场的真实密度：货架与在库量是「铺店已到位」的直接证据，拿掉它，这一页只剩结论没有现场",
          "role": "media",
          "safe_area": {
            "height": 0.8,
            "width": 0.52,
            "x": 0.0,
            "y": 0.1
          },
          "source": "assets/warehouse.jpg",
          "source_px": {
            "height": 1024,
            "width": 1536
          },
          "text_color": "dark",
          "type": "image",
          "width": 496.0,
          "x": 712.0,
          "y": 56.0
        },
        {
          "_measured": {
            "degraded": false,
            "lines": 1,
            "max_line_width": 132.4
          },
          "align": "left",
          "anchor": "top",
          "bold": false,
          "color": "muted",
          "height": 17,
          "id": "s01.source",
          "layout_source": "plan",
          "line_height": 1.3,
          "max_lines": 2,
          "role": "source",
          "size": 13.0,
          "text": "澄海净水内部经营看板",
          "tracking": 0.2,
          "type": "text",
          "width": 592.0,
          "wrap": true,
          "x": 72.0,
          "y": 632.0
        }
      ],
      "id": "s01",
      "index": 0,
      "layout_source": "plan",
      "meta": {
        "basis": "已开票收入，不含退货",
        "claim_absent": false,
        "density": "dense",
        "emphasis": "normal",
        "emphasis_applied": false,
        "emphasis_notes": [],
        "focus": "subject",
        "has_numeric_evidence": false,
        "measured": true,
        "media": {
          "avoid": [],
          "decision": "existing",
          "fit": "cover",
          "function": "hero",
          "path": "assets/warehouse.jpg",
          "reason": "让观众看见渠道现场的真实密度：货架与在库量是「铺店已到位」的直接证据，拿掉它，这一页只剩结论没有现场",
          "role": "subject",
          "safe_area": {
            "height": 0.8,
            "width": 0.52,
            "x": 0.0,
            "y": 0.1
          },
          "source": "author",
          "subject": "",
          "text_color": "dark",
          "why": "作者声明素材（function=hero）：原样生效；素材文件已存在，按既有素材使用"
        },
        "metrics": [],
        "open_questions": [
          "PROBE_CAUSAL_RISK",
          "PROBE_VISUAL_SUBJECT"
        ],
        "period": "2026 Q1–Q3",
        "reading_seconds": 7.0,
        "rhythm": "open",
        "role": "establish",
        "source": "澄海净水内部经营看板",
        "source_zone": {
          "height": 40.0,
          "width": 592.0,
          "x": 72.0,
          "y": 632.0
        },
        "unit": "万元"
      }
    },
    {
      "accent_elements": 0,
      "composition": "metric_row",
      "composition_downgraded": "",
      "composition_why": "多指标并排但不构成可相减的两端：并排呈现量级，不造差值轴",
      "elements": [
        {
          "_measured": {
            "degraded": false,
            "lines": 1,
            "max_line_width": 17.7
          },
          "align": "left",
          "anchor": "top",
          "bold": false,
          "color": "muted",
          "height": 21,
          "id": "s02.eyebrow",
          "layout_source": "plan",
          "line_height": 1.42,
          "max_lines": 2,
          "role": "eyebrow",
          "size": 15.0,
          "text": "02",
          "tracking": 0.8,
          "type": "text",
          "width": 816.0,
          "wrap": true,
          "x": 72.0,
          "y": 56.0
        },
        {
          "_measured": {
            "degraded": false,
            "lines": 1,
            "max_line_width": 530.4
          },
          "align": "left",
          "anchor": "top",
          "bold": true,
          "color": "ink",
          "height": 72,
          "id": "s02.claim",
          "layout_source": "plan",
          "line_height": 1.12,
          "max_lines": 3,
          "role": "claim",
          "size": 60.0,
          "text": "门店在增，产出在跌",
          "tracking": -0.9,
          "type": "text",
          "width": 976.0,
          "wrap": true,
          "x": 72.0,
          "y": 96.0
        },
        {
          "_measured": {
            "degraded": false,
            "lines": 1,
            "max_line_width": 124.3
          },
          "align": "left",
          "anchor": "bottom",
          "bold": true,
          "color": "ink",
          "height": 52,
          "id": "s02.metric_value.1",
          "layout_source": "plan",
          "line_height": 1.24,
          "max_lines": 1,
          "role": "metric_value.1",
          "size": 42.0,
          "text": "128 家",
          "tracking": -0.3,
          "type": "text",
          "width": 360.0,
          "wrap": true,
          "x": 72.0,
          "y": 288.0
        },
        {
          "_measured": {
            "degraded": false,
            "lines": 1,
            "max_line_width": 75.2
          },
          "align": "left",
          "anchor": "top",
          "bold": false,
          "color": "ink",
          "height": 25,
          "id": "s02.metric_label.1",
          "layout_source": "plan",
          "line_height": 1.4,
          "max_lines": 1,
          "role": "metric_label.1",
          "size": 18.0,
          "text": "门店数量",
          "tracking": 0.8,
          "type": "text",
          "width": 360.0,
          "wrap": true,
          "x": 72.0,
          "y": 392.0
        },
        {
          "_measured": {
            "degraded": false,
            "lines": 1,
            "max_line_width": 98.3
          },
          "align": "left",
          "anchor": "bottom",
          "bold": true,
          "color": "ink",
          "height": 52,
          "id": "s02.metric_value.2",
          "layout_source": "plan",
          "line_height": 1.24,
          "max_lines": 1,
          "role": "metric_value.2",
          "size": 42.0,
          "text": "21 %",
          "tracking": -0.3,
          "type": "text",
          "width": 360.0,
          "wrap": true,
          "x": 456.0,
          "y": 288.0
        },
        {
          "_measured": {
            "degraded": false,
            "lines": 1,
            "max_line_width": 151.5
          },
          "align": "left",
          "anchor": "top",
          "bold": false,
          "color": "ink",
          "height": 25,
          "id": "s02.metric_label.2",
          "layout_source": "plan",
          "line_height": 1.4,
          "max_lines": 1,
          "role": "metric_label.2",
          "size": 18.0,
          "text": "单店月均产出降幅",
          "tracking": 0.8,
          "type": "text",
          "width": 360.0,
          "wrap": true,
          "x": 456.0,
          "y": 392.0
        },
        {
          "_measured": {
            "degraded": false,
            "lines": 1,
            "max_line_width": 98.3
          },
          "align": "left",
          "anchor": "bottom",
          "bold": true,
          "color": "ink",
          "height": 52,
          "id": "s02.metric_value.3",
          "layout_source": "plan",
          "line_height": 1.24,
          "max_lines": 1,
          "role": "metric_value.3",
          "size": 42.0,
          "text": "18 %",
          "tracking": -0.3,
          "type": "text",
          "width": 360.0,
          "wrap": true,
          "x": 848.0,
          "y": 288.0
        },
        {